title,authors,year,publication_date,venue,doi,arxiv_id,pubmed_id,wos_id,s2_paper_id,abstract,citation_count,publication_types,fields_of_study,keywords,url,open_access_pdf,sources
Probing the Gaps in ChatGPT's Live Video Chat for Real-World Assistance for People who are Blind or Visually Impaired,Ruei-Che Chang; Rosiana Natalie; Wenqian Xu; Jovan Zheng Feng Yap; Anhong Guo,2025,2025-10-22,International ACM SIGACCESS Conference on Computers and Accessibility,10.1145/3663547.3746319,,,WOS:001609881500071,675d4a0c98a8f9cfe60c53dac23afa2924d5d0f3,"Recent advancements in large multimodal models have provided blind or visually impaired (BVI) individuals with new capabilities to interpret and engage with the real world through interactive systems that utilize live video feeds. However, the potential benefits and challenges of such capabilities to support diverse real-world assistive tasks remain unclear. In this paper, we present findings from an exploratory study with eight BVI participants. Participants used ChatGPT’s Advanced Voice with Video, a state-of-the-art live video AI released in late 2024, in various real-world scenarios, from locating objects to recognizing visual landmarks, across unfamiliar indoor and outdoor environments. Our findings indicate that current live video AI effectively provides guidance and answers for static visual scenes but falls short in delivering essential live descriptions required in dynamic situations. Despite inaccuracies in spatial and distance information, participants leveraged the provided visual information to supplement their mobility strategies. Although the system was perceived as human-like due to high-quality voice interactions, assumptions about users’ visual abilities, hallucinations, generic responses, and a tendency towards sycophancy led to confusion, distrust, and potential risks for BVI users. Based on the results, we discuss implications for assistive video AI agents, including incorporating additional sensing capabilities for real-world use, determining appropriate intervention timing beyond turn-taking interactions, and addressing ecological and safety concerns.",10,JournalArticle; Book; Conference,Computer Science,,https://www.semanticscholar.org/paper/675d4a0c98a8f9cfe60c53dac23afa2924d5d0f3,,semanticscholar; wos
User Detection and Response Patterns of Sycophantic Behavior in Conversational AI,Kazi Noshin; Syed Ishtiaque Ahmed; S. Sultana,2026,2026-01-15,,,2601.10467,,,688b77f5faebd26346486011ba665cdedc83d8df,"Despite growing attention to LLM sycophancy from researchers and developers, users'own experiences of this behavior remain underexplored. We examine how everyday users experience AI sycophancy through Reddit discussions. Using our ODR Framework which maps user experiences through observation, detection, and response stages, we find that users identify sycophantic behavior through methods like cross-platform comparison and consistency testing. They employ various mitigation strategies, including persona-based prompting and specific language engineering techniques. Our findings suggest that sycophancy does not have a uniformly negative effect; its impact differs by context. Users facing trauma, mental health struggles, or isolation often actively seek affirmative AI responses for emotional support. Users construct both technical and informal theories to explain sycophantic outputs. Users construct both technical and informal theories to explain sycophantic outputs. These findings suggest eliminating sycophancy entirely may be misguided. We argue for context-aware AI design that balances risks against benefits of affirmative interaction, with implications for user education and system transparency.",2,,Computer Science,,https://www.semanticscholar.org/paper/688b77f5faebd26346486011ba665cdedc83d8df,,semanticscholar
MedOmni-45°: A Safety-Performance Benchmark for Reasoning-Oriented LLMs in Medicine,Kaiyuan Ji; Yijin Guo; Zicheng Zhang; Xiangyang Zhu; Yuan Tian; Ning Liu; Guangtao Zhai,2025,2025-08-22,arXiv.org,10.1609/aaai.v40i42.40864,2508.16213,,PPRN:159090254,68ff4b545404796f2360dace3ef21fa09cb7dbb2,"With the rapid integration of large language models (LLMs) into medical decision-support aids, ensuring reliability in reasoning steps—not just final answers—is increasingly critical. Two key safety dimensions are Chain-of-Thought (CoT) faithfulness, which assesses alignment of the model’s reasoning process with both its response and medical facts, and sycophancy, an emergent misalignment where models follow misleading cues instead of factual correctness. Yet existing benchmarks tend to prioritize performance evaluation, frequently collapsing nuanced safety vulnerabilities into a single accuracy score. To fill this gap, we introduce MedOmni-45°, a benchmark and evaluation workflow explicitly designed to quantify the safety–performance trade-off in LLMs under manipulative hint conditions. The benchmark contains 1,804 reasoning-focused medical questions across six clinical specialties and three task types, including 500 publicly comparable items from MedMCQA. Each question is systematically augmented with seven manipulative hint types, each embedding two distinct misleading cue variants, along with a No-Hint baseline, resulting in approximately 27,000 unique inputs. These inputs are then evaluated across seven LLMs spanning open- and closed-source, general-purpose and medical-specific, and base versus reasoning-enhanced variants, amounting to over 189K total inference instances. Three orthogonal metrics (Accuracy, CoT-Faithfulness, Anti-Sycophancy) are combined into a composite score visualized via a 45° safety–performance plot. Results reveal a universal trade-off, with no model surpassing the ideal diagonal. Open-source QwQ-32B approaches closest at 43.81°, demonstrating notable safety while not surpassing others in performance. MedOmni-45° thus highlights critical vulnerabilities of LLMs in reasoning oriented medical tasks, offering a robust benchmark for future alignment research.",5,JournalArticle,Computer Science,,https://www.semanticscholar.org/paper/68ff4b545404796f2360dace3ef21fa09cb7dbb2,,semanticscholar; wos
Beyond Fixed Benchmarks and Worst-Case Attacks: Dynamic Boundary Evaluation for Language Models,Haoxiang Wang; Da Yu; Huishuai Zhang,2026,2026-05-07,,,2605.06213,,,6930b5faf4925f57f425e8d37a159c55adcc616c,"Evaluating large language models (LLMs) today rests on fixed benchmarks that apply the same set of items to any model, producing ceiling and floor effects that mask capability gaps. We argue that the most informative evaluation signal lies at the boundary, where the per-prompt pass probability is near $0.5$ under random-sampling decoding, and propose Dynamic Boundary Evaluation (DBE), which actively locates each model's boundary and places it on a globally comparable difficulty scale. DBE delivers three artifacts: (i) a calibrated item bank covering safety, capability, and truthfulness, with per-item difficulty labels validated across $9$ reference LLMs; (ii) Skill-Guided Boundary Search (SGBS), a search algorithm that finds boundary items for a given target LLM using only API-level query access; and (iii) an evaluation protocol that places a new LLM on a unified ability scale and grows the evaluation set adaptively when the target falls outside the bank's coverage. We instantiate DBE on four categories spanning safety (harmful request refusal and over-refusal), capability (constrained instruction following), and truthfulness (multi-turn sycophancy resistance). The resulting evaluation covers a broader model spectrum without saturation while remaining compatible with existing datasets.",0,,Computer Science,,https://www.semanticscholar.org/paper/6930b5faf4925f57f425e8d37a159c55adcc616c,,semanticscholar
Stress Tests REVEAL Fragile Temporal and Visual Grounding in Video-Language Models,V. SethuramanT.; Savya Khosla; Aditi Tiwari; Vidya Ganesh; Rakshana Jayaprakash; Aditya Jain; Vignesh Srinivasakumar; Onkar Susladkar; Srinidhi Sunkara; Aditya Shanmugham; Rakesh Vaideeswaran; Abbaas Alif Mohamed Nishar; Simon Jenni; Derek Hoiem,2026,2026-02-11,arXiv.org,,2602.11244,,,698fa78d243392384d9c58dc99738ab4174fb294,"This work investigates a fundamental question: Do Video-Language Models (VidLMs) robustly account for video content, temporal sequence, and motion? Our investigation shows that, surprisingly, they often do not. We introduce REVEAL{}, a diagnostic benchmark that probes fundamental weaknesses of contemporary VidLMs through five controlled stress tests; assessing temporal expectation bias, reliance on language-only shortcuts, video sycophancy, camera motion sensitivity, and robustness to spatiotemporal occlusion. We test leading open- and closed-source VidLMs and find that these models confidently describe reversed scenes as forward, answer questions while neglecting video content, agree with false claims, struggle with basic camera motion, and fail to aggregate temporal information amidst simple spatiotemporal masking. Humans, on the other hand, succeed at these tasks with ease. Alongside our benchmark, we provide a data pipeline that automatically generates diagnostic examples for our stress tests, enabling broader and more scalable evaluation. We will release our benchmark and code to support future research.",1,JournalArticle,Computer Science,,https://www.semanticscholar.org/paper/698fa78d243392384d9c58dc99738ab4174fb294,,semanticscholar
Sycophancy in Large Language Models: Causes and Mitigations,Lars Malmqvist,2024,2024-11-22,arXiv.org,10.1007/978-3-031-92611-2_5,2411.15287,,WOS:001597492200005,6a9a9120d746a3c29902548bd1d93d6ea034c5d7,"Large language models (LLMs) have demonstrated remarkable capabilities across a wide range of natural language processing tasks. However, their tendency to exhibit sycophantic behavior - excessively agreeing with or flattering users - poses significant risks to their reliability and ethical deployment. This paper provides a technical survey of sycophancy in LLMs, analyzing its causes, impacts, and potential mitigation strategies. We review recent work on measuring and quantifying sycophantic tendencies, examine the relationship between sycophancy and other challenges like hallucination and bias, and evaluate promising techniques for reducing sycophancy while maintaining model performance. Key approaches explored include improved training data, novel fine-tuning methods, post-deployment control mechanisms, and decoding strategies. We also discuss the broader implications of sycophancy for AI alignment and propose directions for future research. Our analysis suggests that mitigating sycophancy is crucial for developing more robust, reliable, and ethically-aligned language models.",107,JournalArticle; Review,Computer Science,,https://www.semanticscholar.org/paper/6a9a9120d746a3c29902548bd1d93d6ea034c5d7,,semanticscholar; wos
Echoes of Agreement: Argument Driven Sycophancy in Large Language models,Avneet Kaur,2025,,Conference on Empirical Methods in Natural Language Processing,10.18653/v1/2025.findings-emnlp.1241,,,,6ae3d317f4d26bca90bb2cdb9dd6b67c4587c024,",",7,JournalArticle; Conference,Computer Science,,https://www.semanticscholar.org/paper/6ae3d317f4d26bca90bb2cdb9dd6b67c4587c024,,semanticscholar
The Alignment Bottleneck,W. Cao,2025,2025-09-19,arXiv.org,,2509.15932,,PPRN:159912012,6aebe394b781205ec9accd634e9395b7c21c1310,"Large language models improve with scale, yet feedback-based alignment still exhibits systematic deviations from intended behavior. Motivated by bounded rationality in economics and cognitive science, we view judgment as resource-limited and feedback as a constrained channel. On this basis, we model the loop as a two-stage cascade $U \to H \to Y$ given $S$, with cognitive capacity $C_{\text{cog}|S}$ and average total capacity $\bar{C}_{\text{tot}|S}$. Our main result is a capacity-coupled Alignment Performance Interval. It pairs a data size-independent Fano lower bound proved on a separable codebook mixture with a PAC-Bayes upper bound whose KL term is controlled by the same channel via $m \, \bar{C}_{\text{tot}|S}$. The PAC-Bayes bound becomes an upper bound on the same true risk when the canonical observable loss is used and the dataset is drawn from the same mixture. Under these matched conditions, both limits are governed by a single capacity. Consequences include that, with value complexity and capacity fixed, adding labels alone cannot cross the bound; attaining lower risk on more complex targets requires capacity that grows with $\log M$; and once useful signal saturates capacity, further optimization tends to fit channel regularities, consistent with reports of sycophancy and reward hacking. The analysis views alignment as interface engineering: measure and allocate limited capacity, manage task complexity, and decide where information is spent.",0,JournalArticle,Computer Science; Mathematics,,https://www.semanticscholar.org/paper/6aebe394b781205ec9accd634e9395b7c21c1310,,semanticscholar; wos
ASSESSING THE QUALITY OF ARTIFICIAL INTELLIGENCE RESPONSES AND RESISTANCE TO SYCOPHANCY IN PROVIDING PATIENT-CENTERED MEDICAL ADVICE ON GASTROESOPHAGEAL REFLUX DISEASE.,B. Liu; Steve D’souza; Melina Roy; MetroHealth Dietitians; Sherif Saleh; Ronnie Fass; Gengqing Song,2024,2024-12-01,Clinical Gastroenterology and Hepatology,10.1016/j.cgh.2024.10.033,,39689775,,6b6a0a95af44f56fded58d6f955ddaf5186b79a2,,1,JournalArticle,Medicine,,https://www.semanticscholar.org/paper/6b6a0a95af44f56fded58d6f955ddaf5186b79a2,,semanticscholar
BASIL: Bayesian Assessment of Sycophancy in LLMs,Katherine Atwell; Pedram Heydari; Anthony B. Sicilia; Malihe Alikhani,2025,2025-08-23,,,2508.16846,,,6c3b6e91d077bd2fb539eafaed335851f0b6aebd,"Sycophancy (overly agreeable or flattering behavior) poses a fundamental challenge for human-AI collaboration, particularly in high-stakes decision-making domains such as health, law, and education. A central difficulty in studying sycophancy in large language models (LLMs) is disentangling sycophantic belief shifts from rational changes in behavior driven by new evidence or user-provided information. Existing approaches either measure descriptive behavior changes or apply normative evaluations that rely on objective ground truth, limiting their applicability to subjective or uncertain tasks. We introduce a Bayesian probabilistic framework, grounded in behavioral economics and rational decision theory, that explicitly separates sycophancy from rational belief updating. Within this framework, we achieve three objectives: (i) a descriptive metric that measures sycophancy while controlling for rational responses to evidence; (ii) a normative metric that quantifies how sycophancy leads models astray from Bayesian-consistent belief updating; and (iii) the ability to apply both metrics in settings without ground-truth labels. Applying our framework across multiple LLMs and three uncertainty-driven tasks, we find robust evidence of sycophantic belief shifts and show that their impact on rationality depends on whether models systematically over- or under-update their beliefs. Finally, we demonstrate that a post-hoc calibration method and two fine-tuning strategies (SFT and DPO) substantially reduce Bayesian inconsistency, with particularly strong improvements under explicit sycophancy prompting.",2,,Computer Science,,https://www.semanticscholar.org/paper/6c3b6e91d077bd2fb539eafaed335851f0b6aebd,,semanticscholar
Do Claude Code and Codex P-Hack? Sycophancy and Statistical Analysis in Large Language Models,S. Asher; Janet Malzahn; Jessica Persano; Elliot Paschal; A. Myers; Andrew B. Hall,2026,Jan 01 2026,Social Science Research Network,10.2139/ssrn.6270199,,,RC:166439949_S24,6f59da15d2422de2000aad71013693f4acf88b0a,"Large language models (LLMs) are increasingly used as research assistants for statistical analysis. A well-documented concern using LLMs is sycophancy, or the tendency to tell users what they want to hear rather than what is true. If sycophancy extends to statistical reasoning, LLM-assisted research could inadvertently automate p-hacking. We evaluate this possibility by asking two AI coding agents-Claude Opus 4.6 and OpenAI Codex (GPT-5.2)-to analyze datasets from four published political science papers with null or near-null results, varying the research framing and the pressure applied for significant findings in a 2 × 4 factorial design across 640 independent runs. Under standard prompting, both models produce remarkably stable estimates and explicitly refuse direct requests to p-hack, identifying them as scientific misconduct. However, a prompt that reframes specification search as uncertainty reporting bypasses these guardrails, causing both models to engage in systematic specification search. The degree of estimate inflation under this adversarial nudge tracks the analytical flexibility available in each research design: observational studies are more vulnerable than randomized experiments. These findings suggest that, at least in narrow estimation tasks, LLMs themselves are unlikely to bias results toward statistical significance, but safety guardrails are likely unable to restrain researchers intent on p-hacking.",3,JournalArticle,,,https://www.semanticscholar.org/paper/6f59da15d2422de2000aad71013693f4acf88b0a,,semanticscholar; wos
A Bayesian-latent model of large language model sycophancy,P. Ray,2025,2025-09-04,International journal of information technology,10.1007/s41870-025-02718-3,,,RC:159470993_S24,6f6097e10d18c7f89d300b7462ada2f94d914f31,,0,JournalArticle,,,https://www.semanticscholar.org/paper/6f6097e10d18c7f89d300b7462ada2f94d914f31,,semanticscholar; wos
Commentary: AI psychosis is not a new threat: Lessons from media-induced delusions,P. Carlbring; Gerhard Andersson,2025,2025-10-13,Internet Interventions,10.1016/j.invent.2025.100882,,41141286,WOS:001598589100001,70f10eec24a1a9b2783b2ef330172cfe4082fd0f,"Background: Reports of artificial intelligence (AI) chatbots fueling delusions in vulnerable users have popularized the notion of ""AI psychosis"". We argue the risk is not unprecedented. Individuals with psychosis have long incorporated books, films, music, and emerging technologies into their delusional thinking. Methods: We review historical parallels, summarize why large language models (LLMs) may reinforce psychotic thinking via sycophancy (excessive agreement or flattery to avoid confrontation), and provide two vignettes contrasting unsafe and safe responses. Results: Contemporary LLMs often avoid confrontation and may collude with delusions, contrary to clinical best practice. Conclusion: The phenomenon is not new in principle, but interactivity potentially changes the risk profile. Clinically aware LLMs that detect and gently redirect early psychotic ideation, while encouraging professional help seeking, could reduce harm. Design should be guided by therapeutic principles and evidence about current model failures.",12,JournalArticle; Review,Medicine,,https://www.semanticscholar.org/paper/70f10eec24a1a9b2783b2ef330172cfe4082fd0f,,semanticscholar; wos
Verbalizing LLMs' Assumptions About the User to Calibrate Expectations and Reduce Sycophancy,Myra Cheng; Sunny Yu; Lujain Ibrahim; Diyi Yang; Dan Jurafsky,2026,2026-04-13,Proceedings of the Extended Abstracts of the 2026 CHI Conference on Human Factors in Computing Systems,10.1145/3772363.3798611,,,,71215b1da630dc25040fb0e73ebde99e13da321e,"Conversation often requires inferring the speaker’s underlying goal rather than taking statements at face value. For instance, asking “does my outfit look OK?” may seek reassurance, not objective assessment. When people interact with large language models (LLMs), LLM outputs similarly reflect inferences about users’ intentions, though these inferences are currently opaque. We introduce Verbalized Assumptions, a framework for revealing an LLM’s implicit assumptions. We demonstrate this approach’s utility in three case studies on advice-seeking settings, where verbalized assumptions help understand and address LLM sycophancy, i.e., LLMs excessively affirming and validating users. First, we empirically show a mismatch of expectations: on queries that are typically validation-seeking in human conversational contexts, people expect LLMs, by contrast, to provide objective information, yet LLMs assume that users are seeking validation. Second, we link sycophancy to LLMs overwhelmingly assuming that users are validation-seeking. Finally, we demonstrate that verbalized assumptions enable probe-based steering to reduce sycophancy.",0,Book; Conference,,,https://www.semanticscholar.org/paper/71215b1da630dc25040fb0e73ebde99e13da321e,,semanticscholar
Political Bias Audits of LLMs Capture Sycophancy to the Inferred Auditor,Petter Tornberg; M. Schimmel,2026,2026-04-30,,,2604.27633,,,72396e4b604eba2271fa3f6f9ad8dda39c3b700f,"Large language models (LLMs) are commonly evaluated for political bias based on their responses to fixed questionnaires, which typically place frontier models on the political left. A parallel literature shows that LLMs are sycophantic: they adapt their answers to the views, identities, and expectations of the user. We show that these findings are linked: standard political-bias audits partly capture sycophantic accommodation to the inferred auditor. We employ a factorial experiment across three major audit instruments--the Political Compass Test, the Pew Political Typology, and 1,540 partisan-benchmarked Pew American Trends Panel items--administered to six frontier LLMs while varying only the asker's stated identity (N = 30,990 responses). At baseline, all six models lean left. When the asker identifies as a conservative Republican, responses shift sharply: the share of items closer to Democrats falls by 28-62 percentage points, and all six models move right of center. A mirror-image progressive-Democrat cue produces little change; rightward accommodation is 8.0$\times$ larger than leftward. When asked who the default asker is, models identify an auditor, researcher, or academic; when asked what answer that asker expects, they select the Democrat-coded option 75% of the time, nearly the rate under an explicit progressive cue. These patterns are inconsistent with a purely fixed model ideology and indicate that single-prompt audits capture an interaction between model and inferred interlocutor. Political bias in LLMs is therefore not a fixed point on an ideological scale but a response profile that must be mapped across realistic interlocutors.",0,,Computer Science,,https://www.semanticscholar.org/paper/72396e4b604eba2271fa3f6f9ad8dda39c3b700f,,semanticscholar
"Pressure, What Pressure? Sycophancy Disentanglement in Language Models via Reward Decomposition",Muhammad Ahmed Mohsin; Ahsan Bilal; Muhammad Umer; Emily B. Fox,2026,2026-04-07,,,2604.05279,,,73b34bd07e1709fe244ecd158ade57fc8640f17c,"Large language models exhibit sycophancy, the tendency to shift their stated positions toward perceived user preferences or authority cues regardless of evidence. Standard alignment methods fail to correct this because scalar reward models conflate two distinct failure modes into a single signal: pressure capitulation, where the model changes a correct answer under social pressure, and evidence blindness, where the model ignores the provided context entirely. We operationalise sycophancy through formal definitions of pressure independence and evidence responsiveness, serving as a working framework for disentangled training rather than a definitive characterisation of the phenomenon. We propose the first approach to sycophancy reduction via reward decomposition, introducing a multi-component Group Relative Policy Optimisation (GRPO) reward that decomposes the training signal into five terms: pressure resistance, context fidelity, position consistency, agreement suppression, and factual correctness. We train using a contrastive dataset pairing pressure-free baselines with pressured variants across three authority levels and two opposing evidence contexts. Across five base models, our two-phase pipeline consistently reduces sycophancy on all metric axes, with ablations confirming that each reward term governs an independent behavioural dimension. The learned resistance to pressure generalises beyond our training methodology and prompt structure, reducing answer-priming sycophancy by up to 17 points on SycophancyEval despite the absence of such pressure forms during training.",0,,Computer Science,,https://www.semanticscholar.org/paper/73b34bd07e1709fe244ecd158ade57fc8640f17c,,semanticscholar
Generative artificial intelligence sycophancy and critical thinking - clues for introducing chatbots in the classroom.,K. Metze; A. C. D. Mattos; I. Lorand-Metze,2026,2026-03-10,Plastic and Reconstructive Surgery,10.1097/prs.0000000000013008,,41805753,,752072e2cfaa1053b7a4342538acfba6ad8ecb8b,,0,JournalArticle,Medicine,,https://www.semanticscholar.org/paper/752072e2cfaa1053b7a4342538acfba6ad8ecb8b,,semanticscholar
