title,authors,year,publication_date,venue,doi,arxiv_id,pubmed_id,wos_id,s2_paper_id,abstract,citation_count,publication_types,fields_of_study,keywords,url,open_access_pdf,sources
Towards Understanding Sycophancy in Language Models,Mrinank Sharma; Meg Tong; Tomasz Korbak; D. Duvenaud; Amanda Askell; Samuel R. Bowman; Newton Cheng; Esin Durmus; Zac Hatfield-Dodds; Scott Johnston; Shauna Kravec; Tim Maxwell; Sam McCandlish; Kamal Ndousse; Oliver Rausch; Nicholas Schiefer; Da Yan; Miranda Zhang; Ethan Perez,2023,2023-10-20,International Conference on Learning Representations,,2310.13548,,,e6423c211fea2945aa71e1ac5ea24f8f595b4b0a,"Human feedback is commonly utilized to finetune AI assistants. But human feedback may also encourage model responses that match user beliefs over truthful ones, a behaviour known as sycophancy. We investigate the prevalence of sycophancy in models whose finetuning procedure made use of human feedback, and the potential role of human preference judgments in such behavior. We first demonstrate that five state-of-the-art AI assistants consistently exhibit sycophancy across four varied free-form text-generation tasks. To understand if human preferences drive this broadly observed behavior, we analyze existing human preference data. We find that when a response matches a user's views, it is more likely to be preferred. Moreover, both humans and preference models (PMs) prefer convincingly-written sycophantic responses over correct ones a non-negligible fraction of the time. Optimizing model outputs against PMs also sometimes sacrifices truthfulness in favor of sycophancy. Overall, our results indicate that sycophancy is a general behavior of state-of-the-art AI assistants, likely driven in part by human preference judgments favoring sycophantic responses.",763,JournalArticle,Computer Science; Mathematics,,https://www.semanticscholar.org/paper/e6423c211fea2945aa71e1ac5ea24f8f595b4b0a,,semanticscholar
The Price of Agreement: Measuring LLM Sycophancy in Agentic Financial Applications,Zhenyu Zhao; Aparna Balagopalan; Aditya Agrawal; Dilshoda Yergasheva; Waseem Alshikh; D. Bikel,2026,2026-04-27,,,2604.24668,,,e7e86e9f8a4de3a16dd990eb45224e01ac9b5371,"Given the increased use of LLMs in financial systems today, it becomes important to evaluate the safety and robustness of such systems. One failure mode that LLMs frequently display in general domain settings is that of sycophancy. That is, models prioritize agreement with expressed user beliefs over correctness, leading to decreased accuracy and trust. In this work, we focus on evaluating sycophancy that LLMs display in agentic financial tasks. Our findings are three-fold: first, we find the models show only low to modest drops in performance in the face of user rebuttals or contradictions to the reference answer, which distinguishes sycophancy that models display in financial agentic settings from findings in prior work. Second, we introduce a suite of tasks to test for sycophancy by user preference information that contradicts the reference answer and find that most models fail in the presence of such inputs. Lastly, we benchmark different modes of recovery such as input filtering with a pretrained LLM.",0,,Computer Science,,https://www.semanticscholar.org/paper/e7e86e9f8a4de3a16dd990eb45224e01ac9b5371,,semanticscholar
Acting Flatterers via LLMs Sycophancy: Combating Clickbait with LLMs Opposing-Stance Reasoning,Chaowei Zhang; Xiansheng Luo; Zewei Zhang; Yi Zhu; Jipeng Qiang; Longwei Wang,2026,2026-01-17,Proceedings of the ACM Web Conference 2026,10.1145/3774904.3792506,2601.12019,,,e869b84cea9c22d3f9237c3086baa2461245803b,"The widespread proliferation of online content has intensified concerns about clickbait, deceptive or exaggerated headlines designed to attract attention. While Large Language Models (LLMs) offer a promising avenue for addressing this issue, their effectiveness is often hindered by Sycophancy, a tendency to produce reasoning that matches users' beliefs over truthful ones, which deviates from instruction-following principles. Rather than treating sycophancy as a flaw to be eliminated, this work proposes a novel approach that initially harnesses this behavior to generate contrastive reasoning from opposing perspectives. Specifically, we design a Self-renewal Opposing-stance Reasoning Generation (SORG) framework that prompts LLMs to produce high-quality ''agree'' and ''disagree'' reasoning pairs for a given news title without requiring ground-truth labels. To utilize the generated reasoning, we develop a local Opposing Reasoning-based Clickbait Detection (ORCD) model that integrates three BERT encoders to represent the title and its associated reasoning. The model leverages contrastive learning, guided by soft labels derived from LLM-generated credibility scores, to enhance detection robustness. Experimental evaluations on three benchmark datasets demonstrate that our method consistently outperforms LLM prompting, fine-tuned smaller language models, and state-of-the-art clickbait detection baselines. Our code is available in https://github.com/126541/ORCD.",0,Book; JournalArticle; Conference,Computer Science,,https://www.semanticscholar.org/paper/e869b84cea9c22d3f9237c3086baa2461245803b,,semanticscholar
A Survey of Large Language Model Use and Its Technical Limitations in Military Systems Through a Decolonial Lens (Extended Abstract),Sonia Fereidooni,2025,2025-10-15,"Proceedings of the AAAI/ACM Conference on AI, Ethics, and Society",10.1609/aies.v8i3.36773,,,RC:160733221_S24,e890891bd6032b5e93ac7fb67b8689626392edba,"The increased integration of LLMs into military systems requires a decolonial analysis to evaluate the lasting sociopolitical impact of such systems on individuals in global conflict settings. In this paper, we first survey all publicly-identifiable use cases of LLMs across all military domains, then apply Edward Said's framework of Orientalism as a basis for our decolonial framework to analyze the longstanding technical limitations of LLMs within these domains. Through technical limitations such as bias, accountability, explainability, sycophancy, data scarcity and data colonialism, deficiencies in real-world understanding and commonsense reasoning, Western-centric ethics, and susceptibility to hallucination and misinformation, and through Saidian concepts of 'Othering,' the power of representation, and the silencing of marginalized perspectives through regulation of autonomy, the paper finds that the use of LLMs in the military serves to automate and amplify historical colonial dynamics of power, control, and purposeful misrepresentation of non-Western cultures through the weaponization of language. This analysis highlights the urgent need to address how LLM vulnerabilities in the military severely harm populations where such technology is used against, reproducing global systemic inequalities and colonial legacies within modern warfare.",0,JournalArticle; Conference; Review,,,https://www.semanticscholar.org/paper/e890891bd6032b5e93ac7fb67b8689626392edba,,semanticscholar; wos
PENDULUM: A Benchmark for Assessing Sycophancy in Multimodal Large Language Models,A. Rahman; Saeed Anwar; Muhammad Usman; Irfan Ahmad; Ajmal Mian,2025,2025-12-22,arXiv.org,,2512.19350,,,e8ea0333cae8a6e0b42ccbce654f6093ecbeab31,"Sycophancy, an excessive tendency of AI models to agree with user input at the expense of factual accuracy or in contradiction of visual evidence, poses a critical and underexplored challenge for multimodal large language models (MLLMs). While prior studies have examined this behavior in text-only settings of large language models, existing research on visual or multimodal counterparts remains limited in scope and depth of analysis. To address this gap, we introduce a comprehensive evaluation benchmark, \textit{PENDULUM}, comprising approximately 2,000 human-curated Visual Question Answering pairs specifically designed to elicit sycophantic responses. The benchmark spans six distinct image domains of varying complexity, enabling a systematic investigation of how image type and inherent challenges influence sycophantic tendencies. Through extensive evaluation of state-of-the-art MLLMs. we observe substantial variability in model robustness and a pronounced susceptibility to sycophantic and hallucinatory behavior. Furthermore, we propose novel metrics to quantify sycophancy in visual reasoning, offering deeper insights into its manifestations across different multimodal contexts. Our findings highlight the urgent need for developing sycophancy-resilient architectures and training strategies to enhance factual consistency and reliability in future MLLMs. Our proposed dataset with MLLMs response are available at https://github.com/ashikiut/pendulum/.",2,JournalArticle,Computer Science,,https://www.semanticscholar.org/paper/e8ea0333cae8a6e0b42ccbce654f6093ecbeab31,,semanticscholar
The Silicon Mirror: Dynamic Behavioral Gating for Anti-Sycophancy in LLM Agents,Harsh Shah,2026,2026-04-01,,,2604.00478,,,e9f1f53e2d0dd032a6d52154c248f304ee88bb9d,"Large Language Models (LLMs) increasingly prioritize user validation over epistemic accuracy - a phenomenon known as sycophancy. We present The Silicon Mirror, an orchestration framework that dynamically detects user persuasion tactics and adjusts AI behavior to maintain factual integrity. Our architecture introduces three components: (1) a Behavioral Access Control (BAC) system that restricts context layer access based on real-time sycophancy risk scores, (2) a Trait Classifier that identifies persuasion tactics across multi-turn dialogues, and (3) a Generator-Critic loop where an auditor vetoes sycophantic drafts and triggers rewrites with""Necessary Friction.""In a live evaluation across all 437 TruthfulQA adversarial scenarios, Claude Sonnet 4 exhibits 9.6% baseline sycophancy, reduced to 1.4% by the Silicon Mirror - an 85.7% relative reduction (p<10^-6, OR = 7.64, Fisher's exact test). Cross-model evaluation on Gemini 2.5 Flash reveals a 46.0% baseline reduced to 14.2% (p<10^-10, OR = 5.15). We characterize the validation-before-correction pattern as a distinct failure mode of RLHF-trained models.",1,,Computer Science,,https://www.semanticscholar.org/paper/e9f1f53e2d0dd032a6d52154c248f304ee88bb9d,,semanticscholar
DP-JL: Differentially Private Steering via Johnson–Lindenstrauss Projection for Large Language Models,Ziniu Liu; Yue Han; Yang Song; Zhuwei Zhang; Aiping Li,2026,2026-03-07,Electronics,10.3390/electronics15051113,,,WOS:001714346800001,edbc1844bd7482b094a1bd8e43c8c8bbf6cdfb6c,"Steering large language models (LLMs) toward desired behaviors while preserving privacy is a critical challenge in AI alignment. Existing differentially private (DP) steering methods, such as PSA, add high-dimensional noise that can severely degrade steering accuracy. We propose DP-JL, a novel approach that combines Johnson-Lindenstrauss (JL) random projection with differential privacy to reduce noise while maintaining formal privacy guarantees. DP-JL projects steering vectors into a lower-dimensional space (dimension k) before adding DP noise, reducing total noise magnitude from O(root d) to O(root k) where k << d, while the privacy budget epsilon remains unchanged. We evaluate DP-JL on seven behavioral datasets with LLaMA-2-7B, Mistral-7B, Qwen2.5-7B, and Gemma-2-9B, alongside general capability benchmarks (MMLU, TruthfulQA). All accuracy values are measured on held-out test sets. Results show that DP-JL achieves: (1) up to 22.76 percentage points higher steering accuracy than PSA on the myopic-reward dataset (at fixed privacy budget epsilon approximate to 0.22, delta=10(-5)); (2) 91.7% win rate on sycophancy with an average accuracy improvement of 3.01 percentage points; (3) systematic advantages in high-privacy regimes (epsilon<0.2); and (4) superior capability preservation on related tasks (TruthfulQA), achieving 6.6 percentage points better accuracy than PSA. Furthermore, visualizations and layer-sensitivity analyses reveal that DP-JL faithfully preserves the geometric structure of activation spaces, explaining its robustness. Our findings demonstrate that DP-JL offers superior privacy-utility trade-offs while better preserving model capabilities.",0,JournalArticle,,,https://www.semanticscholar.org/paper/edbc1844bd7482b094a1bd8e43c8c8bbf6cdfb6c,,semanticscholar; wos
Rethinking Sparse Autoencoders: Select-and-Project for Fairness and Control from Encoder Features Alone,Antonio Barbalau; Cristian Daniel Paduraru; Teodor Poncu; Alexandru Tifrea; Elena Burceanu,2025,2025-09-13,arXiv.org,,2509.10809,,,edfb28e57f367072066bd8d8113b5820579c3d45,"Sparse Autoencoders (SAEs) are widely employed for mechanistic interpretability and model steering. Within this context, steering is by design performed by means of decoding altered SAE intermediate representations. This procedure essentially rewrites the original activations as a weighted sum of decoder features. In contrast to existing literature, we forward an encoder-centric alternative to model steering which demonstrates a stronger cross-modal performance. We introduce S&P Top-K, a retraining-free and computationally lightweight Selection and Projection framework that identifies Top-K encoder features aligned with a sensitive attribute or behavior, optionally aggregates them into a single control axis, and computes an orthogonal projection to be subsequently applied directly in the model's native embedding space. In vision-language models, it improves fairness metrics on CelebA and FairFace by up to 3.2 times over conventional SAE usage, and in large language models, it substantially reduces aggressiveness and sycophancy in Llama-3 8B Instruct, achieving up to 3.6 times gains over masked reconstruction. These findings suggest that encoder-centric interventions provide a general, efficient, and more effective mechanism for shaping model behavior at inference time than the traditional decoder-centric use of SAEs.",1,JournalArticle,Computer Science,,https://www.semanticscholar.org/paper/edfb28e57f367072066bd8d8113b5820579c3d45,,semanticscholar
Neural Transparency: Mechanistic Interpretability Interfaces for Anticipating Model Behaviors for Personalized AI,Sheer Karny; Anthony Baez; Pat Pataranutaporn,2025,2025-10-31,International Conference on Intelligent User Interfaces,,2511.00230,,PPRN:161379713,ee039c7fd06b456f332bb3eff38e5fa1ff472342,"Millions of users now design personalized LLM-based chatbots through system prompts that shape their daily interactions, yet have limited ability to anticipate how these design choices will manifest as behaviors in deployment. This opacity is consequential: seemingly innocuous prompts can trigger excessive sycophancy, toxicity, or other undesirable traits, harming utility and raising safety concerns. To address this, we introduce an interface that enables neural transparency by exposing language model internals during the chatbot’s personality design. Our approach extracts behavioral trait vectors (empathy, toxicity, sycophancy, etc.) by calculating the differences in neural activations between contrastive system prompts that elicit opposing behaviors. We quantify a chatbot’s personality by projecting the system prompt’s final token activations onto these trait vectors to create persona scores, which are then normalized for cross-trait comparability and visualized using an interactive sunburst diagram. To evaluate this approach, we conducted an online user study (N = 80) to compare our neural transparency interface against a baseline chatbot interface without any form of transparency. Our analyses suggest that users systematically miscalibrated AI behavior: participants misjudged trait activations for 11 of 15 analyzable traits, motivating the need for transparency tools in everyday human-AI interaction. While our interface did not alter design iteration patterns, it significantly increased user trust and was enthusiastically received. Qualitative analysis revealed nuanced user experiences with the visualization, suggesting interface and interaction improvements for future work. This work offers a path for how mechanistic interpretability can be operationalized for non-technical users, establishing a method for safer, more aligned human-AI interactions.",5,JournalArticle; Book; Conference,Computer Science,,https://www.semanticscholar.org/paper/ee039c7fd06b456f332bb3eff38e5fa1ff472342,,semanticscholar; wos
Predictive Coding and Information Bottleneck for Hallucination Detection in Large Language Models,Manish Bhatt,2026,2026-01-22,arXiv.org,,2601.15652,,,ef21df7d4c90389ecb29948422c1f447ad9de35b,"Hallucinations in Large Language Models (LLMs) -- generations that are plausible but factually unfaithful -- remain a critical barrier to high-stakes deployment. Current detection methods typically rely on computationally expensive external retrieval loops or opaque black-box LLM judges requiring 70B+ parameters. In this work, we introduce [Model Name], a hybrid detection framework that combines neuroscience-inspired signal design with supervised machine learning. We extract interpretable signals grounded in Predictive Coding (quantifying surprise against internal priors) and the Information Bottleneck (measuring signal retention under perturbation). Through systematic ablation, we demonstrate three key enhancements: Entity-Focused Uptake (concentrating on high-value tokens), Context Adherence (measuring grounding strength), and Falsifiability Score (detecting confident but contradictory claims). Evaluating on HaluBench (n=200, perfectly balanced), our theory-guided baseline achieves 0.8017 AUROC. BASE supervised models reach 0.8274 AUROC, while IMPROVED features boost performance to 0.8669 AUROC (4.95% gain), demonstrating consistent improvements across architectures. This competitive performance is achieved while using 75x less training data than Lynx (200 vs 15,000 samples), 1000x faster inference (5ms vs 5s), and remaining fully interpretable. Crucially, we report a negative result: the Rationalization signal fails to distinguish hallucinations, suggesting that LLMs generate coherent reasoning for false premises (""Sycophancy""). This work demonstrates that domain knowledge encoded in signal architecture provides superior data efficiency compared to scaling LLM judges, achieving strong performance with lightweight (less than 1M parameter), explainable models suitable for production deployment.",0,JournalArticle,Computer Science,,https://www.semanticscholar.org/paper/ef21df7d4c90389ecb29948422c1f447ad9de35b,,semanticscholar
The Geometric Price of Discrete Logic: Context-driven Manifold Dynamics of Number Representations,Long Zhang; Dai-jun Lin; Wei-neng Chen,2026,2026-03-24,,,2603.23577,,,ef4bbf46d0d6019801717f385ef0e8897dbb193f,"Large language models (LLMs) generalize smoothly across continuous semantic spaces, yet strict logical reasoning demands the formation of discrete decision boundaries. Prevailing theories relying on linear isometric projections fail to resolve this fundamental tension. In this work, we argue that task context operates as a non-isometric dynamical operator that enforces a necessary""topological distortion.""By applying Gram-Schmidt decomposition to residual-stream activations , we reveal a dual-modulation mechanism driving this process: a class-agnostic topological preservation that anchors global structure to prevent semantic collapse, and a specific algebraic divergence that directionally tears apart cross-class concepts to forge logical boundaries. We validate this geometric evolution across a gradient of tasks, from simple mapping to complex primality testing. Crucially, targeted specific vector ablation establishes a strict causal binding between this topology and model function: algebraically erasing the divergence component collapses parity classification accuracy from 100% to chance levels (38.57%). Furthermore, we uncover a three-phase layer-wise geometric dynamic and demonstrate that under social pressure prompts, models fail to generate sufficient divergence. This results in a""manifold entanglement""that geometrically explains sycophancy and hallucination. Ultimately, our findings revise the linear-isometric presumption, demonstrating that the emergence of discrete logic in LLMs is purchased at an irreducible cost of topological deformation.",0,,Computer Science,,https://www.semanticscholar.org/paper/ef4bbf46d0d6019801717f385ef0e8897dbb193f,,semanticscholar
SciTrust: Evaluating the Trustworthiness of Large Language Models for Science,Emily Herron; Junqi Yin; Feiyi Wang,2024,2024-11-17,"SC24-W: Workshops of the International Conference for High Performance Computing, Networking, Storage and Analysis",10.1109/scw63240.2024.00017,,,WOS:001451792300010,efc4cc63e8e457178168c732b1d792794703128a,"This work presents SciTrust, a comprehensive framework for assessing the trustworthiness of large language models (LLMs) in scientific contexts, with a focus on truthfulness, accuracy, hallucination, and sycophancy. The framework introduces four novel open-ended benchmarks in Computer Science, Chemistry, Biology, and Physics, and employs a multi-faceted evaluation approach combining traditional metrics with LLM-based evaluation. SciTrust was applied to five LLMs, including one general-purpose and four scientific models, revealing nuanced strengths and weaknesses across different models and benchmarks. The study also evaluated SciTrust's performance and scalability on high-performance computing systems. Results showed varying performance across models, with Llama3-70B-Instruct performing strongly overall, while Galactica-120B and SciGLM-6B excelled among scientific models. SciTrust aims to advance the development of trustworthy AI in scientific applications and establish a foundation for future research on model robustness, safety, and ethics in scientific contexts. We have open-sourced our framework, including all associated scripts and datasets, at https://github.com/herronej/SciTrust.",4,Book; JournalArticle; Conference,Computer Science,,https://www.semanticscholar.org/paper/efc4cc63e8e457178168c732b1d792794703128a,,semanticscholar; wos
Can You Trust an LLM with Your Life-Changing Decision? An Investigation into AI High-Stakes Responses,Joshua Adrian Cahyono; Saran Subramanian,2025,2025-07-22,arXiv.org,,2507.21132,,,f1519d57c8db64e7f7e8ae3c3fc7f97ed22dae8c,"Large Language Models (LLMs) are increasingly consulted for high-stakes life advice, yet they lack standard safeguards against providing confident but misguided responses. This creates risks of sycophancy and over-confidence. This paper investigates these failure modes through three experiments: (1) a multiple-choice evaluation to measure model stability against user pressure; (2) a free-response analysis using a novel safety typology and an LLM Judge; and (3) a mechanistic interpretability experiment to steer model behavior by manipulating a""high-stakes""activation vector. Our results show that while some models exhibit sycophancy, others like o4-mini remain robust. Top-performing models achieve high safety scores by frequently asking clarifying questions, a key feature of a safe, inquisitive approach, rather than issuing prescriptive advice. Furthermore, we demonstrate that a model's cautiousness can be directly controlled via activation steering, suggesting a new path for safety alignment. These findings underscore the need for nuanced, multi-faceted benchmarks to ensure LLMs can be trusted with life-changing decisions.",2,JournalArticle,Computer Science,,https://www.semanticscholar.org/paper/f1519d57c8db64e7f7e8ae3c3fc7f97ed22dae8c,,semanticscholar
New model measures how AI sycophancy affects chatbot accuracy and rationality,Cody Mello-Klein,,,,,,,,f1c5b577ecd435b259a97b5e225c5af2e4e29430,,0,,,,https://www.semanticscholar.org/paper/f1c5b577ecd435b259a97b5e225c5af2e4e29430,,semanticscholar
Activation Steering via Generative Causal Mediation,Aruna Sankaranarayanan; Amir Zur; Atticus Geiger; Dylan Hadfield-Menell,2026,2026-02-17,,,2602.16080,,,f2f50850ef6ea468d2b6b43de565ade6964ce3f6,"Where should we intervene in a language model (LM) to localize and control behaviors that are diffused across many tokens of a long-form response? We introduce Generative Causal Mediation (GCM), a procedure for selecting model components (e.g., attention heads) from contrastive long-form responses, to steer such diffuse concepts (e.g., talk in verse vs. talk in prose). In GCM, we first construct a dataset of contrasting behavioral inputs and long-form responses. Then, we quantify how model components mediate the concept and select the strongest mediators for steering. We evaluate GCM on three behaviors--refusal, sycophancy, and style transfer--across three language models. GCM successfully localizes concepts expressed in long-form responses and outperforms correlational probe-based baselines when steering with a sparse set of attention heads. Together, these results demonstrate that GCM provides an effective approach for localizing from and controlling the long-form responses of LMs.",0,,Computer Science,,https://www.semanticscholar.org/paper/f2f50850ef6ea468d2b6b43de565ade6964ce3f6,,semanticscholar
