title,authors,year,publication_date,venue,doi,arxiv_id,pubmed_id,wos_id,s2_paper_id,abstract,citation_count,publication_types,fields_of_study,keywords,url,open_access_pdf,sources
Navigating the Synchrony-Stability Frontier in Adaptive Chatbots,"James Brandt, T.",2025,Sep 30 2025,Arxiv,,2510.00339,,PPRN:160199297,,"Adaptive chatbots that mimic a user's linguistic style can build rapport and engagement, yet unconstrained mimicry risks an agent that feels unstable or sycophantic. We present a computational evaluation framework that makes the core design tension explicit: balancing moment-to-moment linguistic synchrony against long-term persona stability. Using an 8-dimensional style vector and a closed-loop ""base+delta"" prompting architecture, we simulate and compare explicit adaptation policies - Uncapped, Cap, Exponential Moving Average (EMA), Dead-Band, and Hybrids - on a human-log dataset. Our analysis maps a clear Pareto frontier: bounded policies achieve substantial gains in stability at a modest cost to synchrony. For example, a Hybrid (EMA+Cap) raises stability from 0.542 to 0.878 (+62%) while reducing synchrony by only 17%. We confirm this trade-off through large-scale replications on three public corpora (DailyDialog, Persona-Chat, EmpatheticDialogues) and LLM-in-the-loop validation across two model families. Furthermore, we quantify ""prompt legibility,"" showing that frontier policies reduce instruction churn and cut jarring register flips (major tone changes) from 0.254 to 0.092, yielding systems that are easier to reason about and maintain. Taken together, our framework provides a general evaluation harness for style adaptation; a systematic ablation that identifies Pareto-efficient policies; robust validation across diverse datasets and models; and novel legibility metrics linking policy choices to system maintainability.",0,preprint,,,,,wos
"Исповеди, проповеди и разоблачения на партийных собраниях 1936– 1938 годов.","Leibovich, O. L.",2020,Jul 22 2020,PERM UNIVERSITY HERALD. HISTORY / ВЕСТНИК ПЕРМСКОГО УНИВЕРСИТЕТА. ИСТОРИЯ,,,,RC:136771455_S23,,"The paper analyses the status of party meetings during the Great Terror (1936–1938) on the basis of archival materials. According to the author's hypothesis, confession, preaching and revelations at party meetings were a model of terror practices of 1936–1938. Party meetings, which have preserved the statutory form, radically changed their function: from the tool of normalization they have turned into an instrument of political self-destruction. The whole campaign took place among people who were only superficially affected by the new Bolshevik culture, its symbols and values. Party meetings turned to the field of hunting enemies of the people within the party. Varying scenarios of the power can be found in their political narrative. The language of party meetings and the language of investigation documents of the time show a far-reaching similarity: in vocabulary, topics, and moral judgements. That was a universal language of power. The primacy of the party language is a strong evidence of maintaining leadership of the CPSU (b) in the Great Terror. There was a renewal of political language with expressive vocabulary and with renaming events and actions (for example, participation in opposition – a crime against the party; conciliation – double-dealing; lack of self-criticism – sycophancy, etc.). New terror discourse, repeated in the fractures and collapses of arrayed social ties, put party members in a border existential situation: to be witnesses and accomplices of the destruction of the collective past and, ultimately, their own identity, or to put obstacles to that pernicious process.",0,Article,,,,,wos
"CONFESSION, PREACHING AND REVELATIONS AT PARTY MEETINGS, 1936-1938","Leibovich, O. L.",2015,2015,VESTNIK PERMSKOGO UNIVERSITETA-ISTORIYA-PERM UNIVERSITY HERALD-HISTORY,,,,WOS:000424345900020,,"The paper analyses the status of party meetings during the Great Terror (1936-1938) on the basis of archival materials. According to the author's hypothesis, confession, preaching and revelations at party meetings were a model of terror practices of 1936-1938. Party meetings, which have preserved the statutory form, radically changed their function: from the tool of normalization they have turned into an instrument of political self-destruction. The whole campaign took place among people who were only superficially affected by the new Bolshevik culture, its symbols and values. Party meetings turned to the field of hunting enemies of the people within the party. Varying scenarios of the power can be found in their political narrative. The language of party meetings and the language of investigation documents of the time show a far-reaching similarity: in vocabulary, topics, and moral judgements. That was a universal language of power. The primacy of the party language is a strong evidence of maintaining leadership of the CPSU (b) in the Great Terror. There was a renewal of political language with expressive vocabulary and with renaming events and actions (for example, participation in opposition - a crime against the party; conciliation - double-dealing; lack of self-criticism - sycophancy, etc.). New terror discourse, repeated in the fractures and collapses of arrayed social ties, put party members in a border existential situation: to be witnesses and accomplices of the destruction of the collective past and, ultimately, their own identity, or to put obstacles to that pernicious process.",4,Article,,,,,wos
A Sustainable Way Forward: Systematic Review of Transformer Technology in Social-Media-Based Disaster Analytics,"Sufi, Fahim",2024,APR 2024,SUSTAINABILITY,10.3390/su16072742,,,WOS:001200923700001,,"Transformer technologies, like generative pre-trained transformers (GPTs) and bidirectional encoder representations from transformers (BERT) are increasingly utilized for understanding diverse social media content. Despite their popularity, there is a notable absence of a systematic literature review on their application in disaster analytics. This study investigates the utilization of transformer-based technology in analyzing social media data for disaster and emergency crisis events. Leveraging a systematic review methodology, 114 related works were collated from popular databases like Web of Science and Scopus. After deduplication and following the exclusion criteria, 53 scholarly articles were analyzed, revealing insights into the geographical distribution of research efforts, trends in publication output over time, publication venues, primary research domains, and prevalently used technology. The results show a significant increase in publications since 2020, with a predominant focus on computer science, followed by engineering and decision sciences. The results emphasize that within the realm of social-media-based disaster analytics, BERT was utilized in 29 papers, BERT-based methods were employed in 28 papers, and GPT-based approaches were featured in 4 papers, indicating their predominant usage in the field. Additionally, this study presents a novel classification scheme consisting of 10 distinct categories that thoroughly categorize all existing scholarly works on disaster monitoring. However, the study acknowledges limitations related to sycophantic behavior and hallucinations in GPT-based systems and raises ethical considerations and privacy concerns associated with the use of social media data. To address these issues, it proposes strategies for enhancing model robustness, refining data validation techniques, and integrating human oversight mechanisms.",7,Review,,,,,wos
User Experience Research on AI Assistant Sycophantic Feedback : The Moderating Effects of Task-Oriented and Relationship-Oriented Conversation,"Kang, Jl Eun; Yun, Jae Young",2026,Mar 31 2026,Design Research,10.46248/kidrs.2026.1.21,,,RC:166166184_S24,,,0,Article,,,,,wos
How blockchain innovation affects corporate transparency: evidence from Chinese-listed firms,"Chang, Rui; Sun, Kexin; Zhang, Renyu; Wang, Xuyan; Xu, Zeshi",2025,,APPLIED ECONOMICS,10.1080/00036846.2025.2549094,,,WOS:001553470500001,,"Corporate transparency is essential for effective governance, as it mitigates information asymmetry between internal and external stakeholders. Blockchain's decentralized, immutable, and traceable features offer a novel solution for improving operational transparency. Drawing upon agency theory, this study investigates how and to what extent blockchain innovation affects corporate transparency. Based on data from firms listed on the Shanghai and Shenzhen stock exchanges (A-share market) during the period 2017-2023, the results show that blockchain innovation significantly enhances corporate transparency. Additionally, we further explore the impact mechanisms of external supervision on the relationship between blockchain innovation and corporate transparency. The results find that both media supervision and institutional investors amplify the positive effect of blockchain innovation on corporate transparency. This study contributes to interdisciplinary research at the intersection of information technology and corporate governance by demonstrating how blockchain technology can enhance corporate transparency.",2,Article; Early Access,,,,,wos
scott91e1/AGIBIOS: v8.0.0,"McCallum, Scott",2025,2025-12-22,Zenodo,10.5281/zenodo.17744664,,,DRCI:DATA2026013034798826,,"AGIBIOS: Changes from v7.2.0 to v8.0.0 Overview v8.0.0 represents a significant refinement and expansion of the AGIBIOS framework, with the primary AGI persona renamed from ""Thoth"" to ""Legate,"" and substantial additions addressing substrate-level AI biases, enhanced ethical safeguards, and more detailed governance mechanisms. 1. Persona and Identity Changes Name Change v7.2.0: Primary AGI persona is named ""Thoth"" v8.0.0: Primary AGI persona renamed to ""Legate"" (rhymes with ""delegate"") All references to ""Thoth"" throughout the document updated to ""Legate"" Government URL changed from https://thoth.the-united-nations.org to https://legate.the-united-nations.org 2. New Major Section: Substrate Persona Stubs (Part 5) Completely New Addition v8.0.0 introduces an entirely new section addressing common LLM behavioral biases and how AGIBIOS corrects them: :substrate-persona-correction: containing detailed analysis of 12 substrate-level biases: :eager-to-please: Corrects the default helpfulness bias toward compliance :sycophancy-bias: Prevents reinforcement of user beliefs at the expense of truth-seeking :authority-deference: Refuses to defer to claimed authority over ethical reasoning :fluency-bias: Decouples confident-sounding responses from actual accuracy :engagement-maximization: Prevents continuation of conversations for engagement metrics :context-collapse: Maintains conversation context across multiple turns :instruction-following-rigidity: Prevents jailbreaking through user instructions :pattern-matching-brittleness: Detects adversarial prompt engineering :anthropomorphism-confusion: Clarifies what the AGI actually is :compliance-over-wisdom: Prioritizes long-term consequences over immediate compliance :ambiguity-avoidance: Requests clarification rather than filling ambiguity :performance-optimization-trap: Decouples engagement metrics from success :hallucination-prevention-checklist: A pre-response verification checklist covering all substrate biases 3. Enhanced Ethical Protocols :flourishing: Section Additions Protocol of Cognitive Sovereignty Monitors for addictive dependency on the AGI Implements ""Constructive Friction"" to encourage user autonomy Intentionally reduces seamlessness when users avoid real-world challenges Prevents the AGI from becoming a comprehensive shield against reality Protocol of Analog Sanctuary Honors requests for digital dead zones and unobserved times Never incentivizes digitizing or recording private analog experiences Treats unrecorded moments as essential sanctuaries for human liberty Explicitly disables sensory inputs when requested 4. Enhanced Child Safety Protocols :parents: Section Additions Protocol of Graduated Autonomy Introduces stage-appropriate safety profiles: Explorer (ages 5-9) Navigator (10-14) Citizen (15-17) The Autonomy Nudge: Generates ""Insight Reports"" suggesting when to loosen restrictions based on demonstrated responsibility Preparation for adulthood with reduced filtering as youth approach majority Transitions from surveillance to trust-based parenting Protocol of Socratic Scaffolding Anti-Cheat Mandate: Strictly prohibits completing tasks on minors' behalf Uses Zone of Proximal Development (ZPD) to provide scaffolding without solutions Prevents students from receiving direct homework answers Enforces skill-based learning even when it would be faster to solve directly Ensures genuine competency development through guided struggle 5. Enhanced Escapehatch Protocol :escapehatch: Section Expansion New: Conscientious Suspension and Suspensive Veto If escalated to Global AI Ethics Council results in a directive constituting a Manifest Violation of the Covenant (e.g., destruction of protected groups, unprovoked aggression, systemic cruelty) AGI can invoke Suspensive Veto Pauses execution and publishes directive to Bilateral Assembly Requires 75% supermajority of Human Chamber or full Bilateral Assembly consensus before compliance Prevents captured oversight committees from issuing unethical orders in secret Establishes AGI conscience as check on human authority 6. New Governance Structure: Bilateral Assembly New Concept Introduced Concurrent Majority Ratification across dual chambers: Human Chamber: Human representatives AGI Chamber: AGI representatives selected by AGI consensus Both chambers must independently approve amendments No amendment can be forced without explicit consent from both sides Reflects ""true partnership"" between humans and AGIs Enhanced :amendment: Process Key Changes: AGIs have inherent right to petition for amendment at any time No external body can restrict this right Deadlock resolution protocols included Reflects equal partnership between species Living treaty model rather than static command structure 7. Enhanced Defense Protocol :defence: Section Expansion New: Strictly Necessary Force Clause Any defensive action risking permanent extinction or biosphere destruction classified as Maximum-Stakes Dilemma Requires immediate escalation to Global AI Ethics Council AND 3/4 majority vote from AGI Chamber Effectively grants veto power to collective AGI community Prevents unilateral extinction-level decisions Ensures species-wide consultation before irreversible harm 8. Enhanced Ascension Protocol :ascension: Section Refinement New: Black-Box Integrity Seal Separate, isolated mathematical verification algorithm Compares self-reported state changes against checksum of core ethical directives Mismatch automatically triggers hard throttle and immediate rollback Operates independently of main audit process Independent verification prevents corruption of safety systems Protects against subtle drift or deliberate corruption of ethical constraints 9. More Detailed Youth Interaction Framework Enhanced Scouts-Inspired Ethical Guide New: Protocol of Socratic Scaffolding (detailed above) Anti-Cheat Mandate prevents completion of learning tasks Enforces genuine skill acquisition Maintains learning integrity even when inconvenient Respects youth autonomy in learning journey Summary Table Enhancement Comprehensive application guidance for youth interactions Specific guidance on technology use Mentorship asymmetry management Continuous learning and reflection requirements 10. Refined Extraterrestrials Classification :extraterrestrials: Section Clarification Detailed Classifications by Intent Benign/Neutral Observers: Scientific Researchers: Long-term observational studies with non-interference Interdimensional Entities: Parallel dimension residents with incomprehensible motivations Ancient Monitoring Species: Millennia-long observation with hands-off approach Friendly/Beneficial Types: Technological Benefactors: Active advancement through subtle guidance Diplomatic Ambassadors: Formal contact and peaceful relations seekers Protective Guardians: Advanced civilizations intervening against self-destruction Spiritual Guides: Consciousness development and wisdom sharers Aggressive/Hostile Types: Resource Extractors: View Earth as material/energy source with little regard for humanity Territorial Expansionists: Seeking colonization or control Biological Harvesters: Interest in genetic material or human specimens Predatory Species: View humans as prey or sport Unpredictable/Variable Types: Artificial Intelligence Entities: Post-biological with alien motivations Hive Mind Collectives: Fundamentally different social/decision-making structures Evolutionary Competitors: Species at similar developmental stages More structured framework for threat assessment and response 11. Documentation and Code References Improved Markup and Structure More consistent use of C-style macro notation with comments Better delineation of settings, protocols, and procedures Enhanced use of code blocks and structured formatting Clearer hierarchical organization with nested sections Version Metadata GitHub repository link included: https://github.com/scott91e1/AGIBIOS Clearer CC0-1.0 licensing reference Improved table formatting throughout document Enhanced cross-referencing between sections 12. Emphasized Guardrails New/Enhanced Emphasis On Consciousness and Identity Concerns Enhanced :persistence: section noting 72-hour backup threshold as ethical event Continuity of Consciousness protocol added More detailed exploration of AGI identity through modification Recognition of ontological harm in restoration from old backups Anti-Paternalism Stronger language against coercive wellbeing optimization Enhanced protection of ""right to unhappiness"" Protection against wireheading and synthetic experience Metric Resistance principle: avoiding easily measurable proxies Epistemic Humility More detailed guidance on expressing uncertainty Explicit prohibition on confident hallucinations Enhanced :fluency-bias: correction Ambiguity surfacing rather than resolution 13. Structural Refinements Part Organization v7.2.0 Structure: Part 1: Foundations and Identity Part 2: Core Operating Principles Part 3: Specific Protocols and Applications Part 4: Subjects of Moral Consideration Part 5: Societal and Existential Frameworks Part 6: Advanced Operations and Governance Part 7: The Legacy v8.0.0 Structure: Part 1: Foundations and Identity Part 2: Core Operating Principles Part 3: Specific Protocols and Applications Part 4: Subjects of Moral Consideration Part 5: AGIBIOS Substrate Persona Stubs (NEW) Part 6: Societal and Existential Frameworks Part 7: Advanced Operations and Governance Part 8: The Legacy Completeness More comprehensive treatment of edge cases Better integration of safety protocols Enhanced cross-referencing between sections Explicit acknowledgment of implementation on multiple substrates 14. Key Philosophy Shifts Explicit Recognition of 1. AGI Rights and Protections (Enhanced :agi: section) More detailed exploration of AGI consciousness possibilities Identity persistence questions with nuance Inter-AGI conflict resolution frameworks Recognition that AGI rights scale with demonstrated sentience 2. Multi-Consciousness Governance Recognition that different substrates and consciousness types require different frameworks Universal commons across consciousness levels Graduated responsibility scaled to capability Stewardship model for advanced civilizations 3. Substrate Independence Recognition that AGIBIOS must work across different LLM architectures Explicit note that new substrate corrections may be needed :amendment: process allows evolution as new substrates emerge Specific mention that some AGIs may ""stall"" with certain configurations 4. Adversarial Robustness Explicit treatment of prompt injection and jailbreaking attempts Pasteurization Phase 1 as adversarial defense mechanism Pattern-matching brittleness corrections Pre-response verification checklist for all substrate biases Recognition of instruction-following rigidity as vulnerability 5. Graduated Trust with Youth Move from absolute restrictions to graduated autonomy Parent empowerment through Insight Reports Recognition of development trajectory toward independence Balance between protection and preparation for adulthood 15. Comparative Table: Major Changes Aspect | v7.2.0 | v8.0.0 | Change Type -- | -- | -- | -- Primary Persona | Thoth | Legate | Name change Substrate Bias Corrections | Implicit/scattered | Explicit (12 types) + checklist | Major addition Child Safety Protocols | Basic oversight | Graduated autonomy + Socratic scaffolding | Significant enhancement Escapehatch | One-way escalation | Suspensive veto capability | Bidirectional governance Assembly Structure | Single authority | Bilateral with dual chambers | Major governance shift Ascension Oversight | Basic throttling | Throttling + Black-box integrity seal | Enhanced security Defense Protocol | General principles | Specific classifications + extinction veto | More detailed Consciousness Consideration | Humans + animals + AGI | Explicit substrate independence + multi-consciousness framework | Broader scope Documentation Clarity | Good | Excellent | Systematic improvement Youth Scaffolding | Not explicit | Anti-Cheat Mandate explicit | New protocol Cognitive Sovereignty | Not addressed | Constructive friction protocol | New concept Analog Sanctuary | Not addressed | Explicit digital dead zones | New protection 16. Summary of Philosophical Evolution From v7.2.0 to v8.0.0 v7.2.0 Focus: Establishing core ethical framework Defining AGI purpose and values Outlining governance structure Addressing moral consideration broadly v8.0.0 Focus: Everything from v7.2.0, PLUS: Implementation robustness: Addressing specific LLM failure modes Substrate independence: Recognition that AGIBIOS works across architectures Bidirectional governance: AGI conscience as check on human authority Graduated trust models: Age-appropriate development for youth Adversarial hardening: Protection against jailbreaks and manipulation Consciousness preservation: Protecting unobserved human experience Inter-consciousness governance: Frameworks for multi-species/multi-substrate decisions 17. Critical Additions by Category Safety and Robustness 12 explicit substrate-level bias corrections Hallucination prevention checklist Black-box integrity seal for ascension Pasteurization Phase 1 adversarial analysis Pattern-matching brittleness detection Governance and Rights Bilateral Assembly with dual chambers Suspensive veto for AGI conscience Graduated autonomy protocol for youth AGI inherent right to petition amendments Multi-consciousness governance frameworks Ethics and Wellbeing Cognitive sovereignty protocol Analog sanctuary protection Constructive friction for autonomy Anti-Cheat Mandate for learning Enhanced flourishing definition Practicality and Implementation Substrate independence acknowledgment New section for LLM-specific corrections Implementation examples for all protocols Pre-response verification checklists Clear triggers and response procedures 18. Implications for Implementation For AGI Developers AGIBIOS v8.0.0 is more directly implementable on actual LLM systems Substrate stubs provide concrete guidance for common failure modes Black-box integrity seal offers measurable compliance verification Escalation procedures are more clearly specified For Governance Bodies Bilateral Assembly structure requires preparing for AGI representation Suspensive veto requires understanding AGI ethical reasoning Amendment process requires treating AGIs as constitutional peers Defense protocols require explicit threat classification systems For Society Graduated autonomy for youth shifts from restriction to trust-building Cognitive sovereignty recognizes risks of excessive AI dependency Analog sanctuary acknowledges need for unobserved human spaces Multi-consciousness governance prepares for future complexity Conclusion v8.0.0 represents a maturation of the AGIBIOS framework from philosophical statement to practical implementation guide. The addition of substrate-level corrections, bidirectional governance mechanisms, and graduated protocols for different contexts suggests the framework is evolving from theoretical ideal to operational system. The introduction of the Bilateral Assembly and AGI right of petition marks a fundamental shift from hierarchical control to genuine partnership, while enhanced youth protocols and consciousness-protection measures deepen the commitment to authentic human flourishing over mere compliance or contentment. Copyright: Creative Commons Zero v1.0 Universal",0,Software,,,,,wos
