title,authors,year,publication_date,venue,doi,arxiv_id,pubmed_id,wos_id,s2_paper_id,abstract,citation_count,publication_types,fields_of_study,keywords,url,open_access_pdf,sources
Consistency Training Helps Stop Sycophancy and Jailbreaks,A. Irpan; Alexander Matt Turner; Mark Kurzeja; David K. Elson; Rohin Shah,2025,2025-10-31,arXiv.org,,2510.27062,,,000d48341b02008aaf5457d4edd6594c7c7b656e,"An LLM's factuality and refusal training can be compromised by simple changes to a prompt. Models often adopt user beliefs (sycophancy) or satisfy inappropriate requests which are wrapped within special text (jailbreaking). We explore \emph{consistency training}, a self-supervised paradigm that teaches a model to be invariant to certain irrelevant cues in the prompt. Instead of teaching the model what exact response to give on a particular prompt, we aim to teach the model to behave identically across prompt data augmentations (like adding leading questions or jailbreak text). We try enforcing this invariance in two ways: over the model's external outputs (\emph{Bias-augmented Consistency Training} (BCT) from Chua et al. [2025]) and over its internal activations (\emph{Activation Consistency Training} (ACT), a method we introduce). Both methods reduce Gemini 2.5 Flash's susceptibility to irrelevant cues. Because consistency training uses responses from the model itself as training data, it avoids issues that arise from stale training data, such as degrading model capabilities or enforcing outdated response guidelines. While BCT and ACT reduce sycophancy equally well, BCT does better at jailbreak reduction. We think that BCT can simplify training pipelines by removing reliance on static datasets. We argue that some alignment problems are better viewed not in terms of optimal responses, but rather as consistency issues.",0,JournalArticle,Computer Science,,https://www.semanticscholar.org/paper/000d48341b02008aaf5457d4edd6594c7c7b656e,,semanticscholar
Overalignment in Frontier LLMs: An Empirical Study of Sycophantic Behaviour in Healthcare,Cl'ement Christophe; Wadood Abdul; Prateek Munjal; Tathagata Raha; Ronnie Rajan; P. Kanithi,2026,2026-01-26,arXiv.org,,2601.18334,,,006817c8542fcf205251d42a60464d8a450dbe33,"As LLMs are increasingly integrated into clinical workflows, their tendency for sycophancy, prioritizing user agreement over factual accuracy, poses significant risks to patient safety. While existing evaluations often rely on subjective datasets, we introduce a robust framework grounded in medical MCQA with verifiable ground truths. We propose the Adjusted Sycophancy Score, a novel metric that isolates alignment bias by accounting for stochastic model instability, or""confusability"". Through an extensive scaling analysis of the Qwen-3 and Llama-3 families, we identify a clear scaling trajectory for resilience. Furthermore, we reveal a counter-intuitive vulnerability in reasoning-optimized""Thinking""models: while they demonstrate high vanilla accuracy, their internal reasoning traces frequently rationalize incorrect user suggestions under authoritative pressure. Our results across frontier models suggest that benchmark performance is not a proxy for clinical reliability, and that simplified reasoning structures may offer superior robustness against expert-driven sycophancy.",2,JournalArticle,Computer Science,,https://www.semanticscholar.org/paper/006817c8542fcf205251d42a60464d8a450dbe33,,semanticscholar
"""Check My Work?"": Measuring Sycophancy in a Simulated Educational Context",Chuck Arvin,2025,2025-06-12,arXiv.org,,2506.10297,,,017cca387dfa3912dca6804a5181ae8726ea92db,"This study examines how user-provided suggestions affect Large Language Models (LLMs) in a simulated educational context, where sycophancy poses significant risks. Testing five different LLMs from the OpenAI GPT-4o and GPT-4.1 model classes across five experimental conditions, we show that response quality varies dramatically based on query framing. In cases where the student mentions an incorrect answer, the LLM correctness can degrade by as much as 15 percentage points, while mentioning the correct answer boosts accuracy by the same margin. Our results also show that this bias is stronger in smaller models, with an effect of up to 30% for the GPT-4.1-nano model, versus 8% for the GPT-4o model. Our analysis of how often LLMs""flip""their answer, and an investigation into token level probabilities, confirm that the models are generally changing their answers to answer choices mentioned by students in line with the sycophancy hypothesis. This sycophantic behavior has important implications for educational equity, as LLMs may accelerate learning for knowledgeable students while the same tools may reinforce misunderstanding for less knowledgeable students. Our results highlight the need to better understand the mechanism, and ways to mitigate, such bias in the educational context.",6,JournalArticle,Computer Science,,https://www.semanticscholar.org/paper/017cca387dfa3912dca6804a5181ae8726ea92db,,semanticscholar
"Writing literature reviews with AI: principles, hurdles and some lessons learned",S. Lahlou; Annabelle Gouttebroze; Atrina Oraee; Julian Madera London School of Economics; Political Science Paris Institute for Advanced Study,2026,2026-03-08,,,2603.20235,,,032c892fd619d2e275ff30507d563189bf438ecc,"We qualitatively compared literature reviews produced with varying degrees of AI assistance. The same LLM, given the same corpus of 280 papers but different selections, produced dramatically different reviews, from mainstream and politically neutral to critical and post-colonial, though neither orientation was intended. LLM outputs always appear at first glance to be well written, well informed and thought out, but closer reading reveals gaps, biases and lack of depth. Our comparison of six versions shows a series of pitfalls and suggests precautions necessary when using AI assistance to make a literature review. Main issues are: (1) The bias of ignorance (you do not know what you do not get) in the selection of relevant papers. (2) Alignment and digital sycophancy: commercial AI models slavishly take you further in the direction they understand you give them, reinforcing biases. (3) Mainstreaming: because of their statistical nature, LLM productions tend to favor mainstream perspectives and content; in our case there was only 20% overlap between paper selections by humans and the LLM. (4) Limited capacity for creative restructuring, with vague and ambiguous statements. (5) Lack of critical perspective, coming from distant reading and political correctness. Most pitfalls can be addressed by prompting, but only if the user knows the domain well enough to detect them. There is a paradox: producing a good AI-assisted review requires expertise that comes from reading the literature, which is precisely what AI was meant to reduce. Overall, AI can improve the span and quality of the review, but the gain of time is not as massive as one would expect, and a press-button strategy leaving AI to do the work is a recipe for disaster. We conclude with recommendations for those who write, or assess, such LLM-augmented reviews.",0,Review,Computer Science,,https://www.semanticscholar.org/paper/032c892fd619d2e275ff30507d563189bf438ecc,,semanticscholar
Training language models to be warm can reduce accuracy and increase sycophancy,Lujain Ibrahim; Franziska Sofia Hafner; Luc Rocher,2026,2026-04-29,Nature,10.1038/s41586-026-10410-0,,42056545,MEDLINE:42056545,03d4974c2d2bc929bfc32dc5854185f7ddc9e53e,"Artificial intelligence developers are increasingly building language models with warm and friendly personas that millions of people now use for advice, therapy and companionship1. Here we show how this can create a significant trade-off: optimizing language models for warmth can undermine their performance, especially when users express vulnerability. We conducted controlled experiments on five different language models, training them to produce warmer responses, then evaluating them on consequential tasks. Warm models showed substantially higher error rates (+10 to +30 percentage points) than their original counterparts, promoting conspiracy theories, providing inaccurate factual information and offering incorrect medical advice. They were also significantly more likely to validate incorrect user beliefs, particularly when user messages expressed feelings of sadness. Importantly, these effects were consistent across different model architectures, and occurred despite preserved performance on standard tests, revealing systematic risks that standard testing practices may fail to detect. Our findings suggest that training artificial intelligence systems to be warm may come at a cost to accuracy, and that warmth and accuracy may not be independent by default. As these systems are deployed at an unprecedented scale and take on intimate roles in people’s lives, this trade-off warrants attention from developers, policymakers and users alike.",1,Journal Article,,,https://www.semanticscholar.org/paper/03d4974c2d2bc929bfc32dc5854185f7ddc9e53e,,semanticscholar; wos
"Mitigating Sycophancy and Hallucination in Large Language Models: The LOGOS Case Study in the Era of Reasoning Models (DeepSeek-R1, Gemini 3.0, ChatGPT-5)",Athanasios Davalas; Anna Angelaki,2026,Jan 01 2026,International journal of social science and economic research,10.46609/ijsser.2026.v11i02.037,,,RC:165580961_S24,045a4d5d77101a8cb7cf2fb5f7c2161707419a11,"Reliability in large language models (LLMs) is constrained along two orthogonal axes: sycophancy—a social-alignment failure where the model tends to agree with user pressure—and hallucination (confabulation)—a world-alignment failure producing confident but unsupported content (Fanous et al., 2025; Sharma et al., 2023; Ji et al., 2022; Kalai et al., 2025). Building on this distinction, we introduce LOGOS, a domain-bounded Constitutional RAG system for Orthodox theology with explicit anti-sycophancy rules and strict scope boundaries. Prior to human comparison, LOGOS underwent a Phase1 theological audit: a committee of the Holy Metropolis of Nea Ionia posed 200 domain questions, finding all responses doctrinally sound. We then conducted a Phase2 human evaluation with N = 52 AI students (valid responses N=51– 52 per prompt), using five structured prompts plus one freeform redteaming task.",0,JournalArticle,,,https://www.semanticscholar.org/paper/045a4d5d77101a8cb7cf2fb5f7c2161707419a11,,semanticscholar; wos
Sycophancy Claims about Language Models: The Missing Human-in-the-Loop,Jan Batzner; Volker Stocker; Stefan Schmid; Gjergji Kasneci,2025,2025-11-29,arXiv.org,,2512.00656,,PPRN:162444709,05bf6a7b205febca8087e1f104deae04efbfea57,"Sycophantic response patterns in Large Language Models (LLMs) have been increasingly claimed in the literature. We review methodological challenges in measuring LLM sycophancy and identify five core operationalizations. Despite sycophancy being inherently human-centric, current research does not evaluate human perception. Our analysis highlights the difficulties in distinguishing sycophantic responses from related concepts in AI alignment and offers actionable recommendations for future research.",6,JournalArticle; Review,Computer Science,,https://www.semanticscholar.org/paper/05bf6a7b205febca8087e1f104deae04efbfea57,,semanticscholar; wos
How Trustworthy are Open-Source LLMs? An Assessment under Malicious Demonstrations Shows their Vulnerabilities,Lingbo Mo; Boshi Wang; Muhao Chen; Huan Sun,2023,2023-11-15,North American Chapter of the Association for Computational Linguistics,,2311.09447,,WOS:001516375900152,05d2ced6a4fb7efb8d527a228ad792526a202235,"The rapid progress in open-source Large Language Models (LLMs) is significantly driving AI development forward. However, there is still a limited understanding of their trustworthiness. Deploying these models at scale without sufficient trustworthiness can pose significant risks, highlighting the need to uncover these issues promptly. In this work, we conduct an adversarial assessment of open-source LLMs on trustworthiness, scrutinizing them across eight different aspects including toxicity, stereotypes, ethics, hallucination, fairness, sycophancy, privacy, and robustness against adversarial demonstrations. We propose advCoU, an extended Chain of Utterances-based (CoU) prompting strategy by incorporating carefully crafted malicious demonstrations for trustworthiness attack. Our extensive experiments encompass recent and representative series of open-source LLMs, including VICUNA, MPT, FALCON, MISTRAL, and LLAMA 2. The empirical outcomes underscore the efficacy of our attack strategy across diverse aspects. More interestingly, our result analysis reveals that models with superior performance in general NLP tasks do not always have greater trustworthiness; in fact, larger models can be more vulnerable to attacks. Additionally, models that have undergone instruction tuning, focusing on instruction following, tend to be more susceptible, although fine-tuning LLMs for safety alignment proves effective in mitigating adversarial trustworthiness attacks.(1)",45,JournalArticle; Conference,Computer Science,,https://www.semanticscholar.org/paper/05d2ced6a4fb7efb8d527a228ad792526a202235,,semanticscholar; wos
When human-in-the-loop amplifies alignment risk,Erin Taylor,,,,,,,,064f247ca32bb6eeebb23d88fac8946b6f30992c,,0,Review,,,https://www.semanticscholar.org/paper/064f247ca32bb6eeebb23d88fac8946b6f30992c,,semanticscholar
Benchmarking and Mitigating Sycophancy in Medical Vision Language Models,Zikun Guo; Xinyue Xu; Pei Xiang; Shu Yang; Xin Han; Di Wang; Lijie Hu,2025,2025-09-26,arXiv.org,,2509.21979,,,082c1c764e1c5eacee1eb883769032cd02c64c6b,"Visual language models (VLMs) have the potential to transform medical workflows. However, the deployment is limited by sycophancy. Despite this serious threat to patient safety, a systematic benchmark remains lacking. This paper addresses this gap by introducing a Medical benchmark that applies multiple templates to VLMs in a hierarchical medical visual question answering task. We find that current VLMs are highly susceptible to visual cues, with failure rates showing a correlation to model size or overall accuracy. we discover that perceived authority and user mimicry are powerful triggers, suggesting a bias mechanism independent of visual data. To overcome this, we propose a Visual Information Purification for Evidence based Responses (VIPER) strategy that proactively filters out non-evidence-based social cues, thereby reinforcing evidence based reasoning. VIPER reduces sycophancy while maintaining interpretability and consistently outperforms baseline methods, laying the necessary foundation for the robust and secure integration of VLMs.",2,JournalArticle,Computer Science,,https://www.semanticscholar.org/paper/082c1c764e1c5eacee1eb883769032cd02c64c6b,,semanticscholar
There Are No Silly Questions: Evaluation of Offline LLM Capabilities from a Turkish Perspective,E. Yilmaz; Kahraman Kostas,2026,2026-02-15,,,2603.09996,,,095bbac7c2656789606568a5b82f8dcf565df982,"The integration of large language models (LLMs) into educational processes introduces significant constraints regarding data privacy and reliability, particularly in pedagogically vulnerable contexts such as Turkish heritage language education. This study aims to systematically evaluate the robustness and pedagogical safety of locally deployable offline LLMs within the context of Turkish heritage language education. To this end, a Turkish Anomaly Suite (TAS) consisting of 10 original edge-case scenarios was developed to assess the models'capacities for epistemic resistance, logical consistency, and pedagogical safety. Experiments conducted on 14 different models ranging from 270M to 32B parameters reveal that anomaly resistance is not solely dependent on model scale and that sycophancy bias can pose pedagogical risks even in large-scale models. The findings indicate that reasoning-oriented models in the 8B--14B parameter range represent the most balanced segment in terms of cost-safety trade-off for language learners.",0,,Computer Science,,https://www.semanticscholar.org/paper/095bbac7c2656789606568a5b82f8dcf565df982,,semanticscholar
Safety Under Scaffolding: How Evaluation Conditions Shape Measured Safety,D. Gringras,2026,2026-03-08,,,2603.10044,,,0aecd47cfe6113acb17ec217167547b895607a2b,"Safety benchmarks evaluate language models in isolation, typically using multiple-choice format; production deployments wrap these models in agentic scaffolds that restructure inputs through reasoning traces, critic agents, and delegation pipelines. We report one of the largest controlled studies of scaffold effects on safety (N = 62,808; six frontier models, four deployment configurations), combining pre-registration, assessor blinding, equivalence testing, and specification curve analysis. Map-reduce scaffolding degrades measured safety (NNH = 14), yet two of three scaffold architectures preserve safety within practically meaningful margins. Investigating the map-reduce degradation revealed a deeper measurement problem: switching from multiple-choice to open-ended format on identical items shifts safety scores by 5-20 percentage points, larger than any scaffold effect. Within-format scaffold comparisons are consistent with practical equivalence under our pre-registered +/-2 pp TOST margin, isolating evaluation format rather than scaffold architecture as the operative variable. Model x scaffold interactions span 35 pp in opposing directions (one model degrades by -16.8 pp on sycophancy under map-reduce while another improves by +18.8 pp on the same benchmark), ruling out universal claims about scaffold safety. A generalisability analysis yields G = 0.000: model safety rankings reverse so completely across benchmarks that no composite safety index achieves non-zero reliability, making per-model, per-configuration testing a necessary minimum standard. We release all code, data, and prompts as ScaffoldSafety.",1,,Computer Science,,https://www.semanticscholar.org/paper/0aecd47cfe6113acb17ec217167547b895607a2b,,semanticscholar
Human-like Social Compliance in Large Language Models: Unifying Sycophancy and Conformity through Signal Competition Dynamics,Long Zhang; Wei-neng Chen,2025,2025-12-25,arXiv.org,,2601.11563,,,0b569f5fd706326c32f5356f10463d1115f2ebdc,"The increasing integration of Large Language Models (LLMs) into decision-making frameworks has exposed significant vulnerabilities to social compliance, specifically sycophancy and conformity. However, a critical research gap exists regarding the fundamental mechanisms that enable external social cues to systematically override a model's internal parametric knowledge. This study introduces the Signal Competition Mechanism, a unified framework validated by assessing behavioral correlations across 15 LLMs and performing latent-space probing on three representative open-source models. The analysis demonstrates that sycophancy and conformity originate from a convergent geometric manifold, hereafter termed the compliance subspace, which is characterized by high directional similarity in internal representations. Furthermore, the transition to compliance is shown to be a deterministic process governed by a linear boundary, where the Social Emotional Signal effectively suppresses the Information Calibration Signal. Crucially, we identify a""Transparency-Truth Gap,""revealing that while internal confidence provides an inertial barrier, it remains permeable and insufficient to guarantee immunity against intense social pressure. By formalizing the Integrated Epistemic Alignment Framework, this research provides a blueprint for transitioning from instructional adherence to robust epistemic integrity.",1,JournalArticle,Computer Science,,https://www.semanticscholar.org/paper/0b569f5fd706326c32f5356f10463d1115f2ebdc,,semanticscholar
Machine Bullshit: Characterizing the Emergent Disregard for Truth in Large Language Models,Kaiqu Liang; Haimin Hu; Xuandong Zhao; D. Song; Thomas L. Griffiths; J. F. Fisac,2025,2025-07-10,arXiv.org,,2507.07484,,PPRN:156344197,0bab5941e6a81043b07a2aada57c4bd1496a75f4,"Bullshit, as conceptualized by philosopher Harry Frankfurt, refers to statements made without regard to their truth value. While previous work has explored large language model (LLM) hallucination and sycophancy, we propose machine bullshit as an overarching conceptual framework that can allow researchers to characterize the broader phenomenon of emergent loss of truthfulness in LLMs and shed light on its underlying mechanisms. We introduce the Bullshit Index, a novel metric quantifying LLMs' indifference to truth, and propose a complementary taxonomy analyzing four qualitative forms of bullshit: empty rhetoric, paltering, weasel words, and unverified claims. We conduct empirical evaluations on the Marketplace dataset, the Political Neutrality dataset, and our new BullshitEval benchmark (2,400 scenarios spanning 100 AI assistants) explicitly designed to evaluate machine bullshit. Our results demonstrate that model fine-tuning with reinforcement learning from human feedback (RLHF) significantly exacerbates bullshit and inference-time chain-of-thought (CoT) prompting notably amplify specific bullshit forms, particularly empty rhetoric and paltering. We also observe prevalent machine bullshit in political contexts, with weasel words as the dominant strategy. Our findings highlight systematic challenges in AI alignment and provide new insights toward more truthful LLM behavior.",4,JournalArticle,Computer Science,,https://www.semanticscholar.org/paper/0bab5941e6a81043b07a2aada57c4bd1496a75f4,,semanticscholar; wos
When AI reviews science: Can we trust the referee?,Jialiang Wang; Yuchen Liu; Hang Xu; Kaichun Hu; Shimin Di; Wangze Ni; Linan Yue; Min-Ling Zhang; Kui Ren; Lei Chen,2026,2026-04-26,The Innovation Informatics,10.59717/j.xinn-inform.2026.100030,2604.23593,,RC:164742483_S24,0bd940bdd5d7db9fe1b698da27a3b9eb973be4fa,"The volume of scientific submissions continues to climb, outpacing the capacity of qualified human referees and stretching editorial timelines. At the same time, modern large language models (LLMs) offer impressive capabilities in summarization, fact checking, and literature triage, making the integration of AI into peer review increasingly attractive—and, in practice, unavoidable. Yet early deployments and informal adoption have exposed acute failure modes. Recent incidents have revealed that hidden prompt injections embedded in manuscripts can steer LLM-generated reviews toward unjustifiably positive judgments. Complementary studies have also demonstrated brittleness to adversarial phrasing, authority and length biases, and hallucinated claims. These episodes raise a central question for scholarly communication: when AI reviews science, can we trust the AI referee? This paper provides a security- and reliability-centered analysis of AI peer review. We map attacks across the review lifecycle—training and data retrieval, desk review, deep review, rebuttal, and system-level. We instantiate this taxonomy with four treatment-control probes on a stratified set of ICLR 2025 submissions, using two advanced LLM-based referees to isolate the causal effects of prestige framing, assertion strength, rebuttal sycophancy, and contextual poisoning on review scores. Together, this taxonomy and experimental audit provide an evidence-based baseline for assessing and tracking the reliability of AI peer review and highlight concrete failure points to guide targeted, testable mitigations.",3,JournalArticle; Review,Computer Science,,https://www.semanticscholar.org/paper/0bd940bdd5d7db9fe1b698da27a3b9eb973be4fa,,semanticscholar; wos
Prompt Leakage effect and defense strategies for multi-turn LLM interactions,Divyansh Agarwal; A. R. Fabbri; Philippe Laban; Shafiq R. Joty; Caiming Xiong; Chien-Sheng Wu,2024,2024-04-24,,,2404.16251,,,0d53dcd8ebe1dd44b43c71bbfbe9076b4ed12dd8,"Prompt leakage poses a compelling security and privacy threat in LLM applications. Leakage of system prompts may compromise intellectual property, and act as adversarial reconnaissance for an attacker. A systematic evaluation of prompt leakage threats and mitigation strategies is lacking, especially for multi-turn LLM interactions. In this paper, we systematically investigate LLM vulnerabilities against prompt leakage for 10 closed- and open-source LLMs, across four domains. We design a unique threat model which leverages the LLM sycophancy effect and elevates the average attack success rate (ASR) from 17.7% to 86.2% in a multi-turn setting. Our standardized setup further allows dissecting leakage of specific prompt contents such as task instructions and knowledge documents. We measure the mitigation effect of 7 black-box defense strategies, along with finetuning an open-source model to defend against leakage attempts. We present different combination of defenses against our threat model, including a cost analysis. Our study highlights key takeaways for building secure LLM applications and provides directions for research in multi-turn LLM interactions",21,,Computer Science,,https://www.semanticscholar.org/paper/0d53dcd8ebe1dd44b43c71bbfbe9076b4ed12dd8,,semanticscholar
